{
  "$schema": "https://json-schema.org/draft/2020-12/schema",
  "$id": "lumenva.plugin.v1",
  "type": "object",
  "required": [
    "id",
    "name",
    "plugin_id",
    "source",
    "measurement_type"
  ],
  "properties": {
    "id": {
      "type": "string",
      "minLength": 1
    },
    "name": {
      "type": "string",
      "minLength": 1
    },
    "plugin_id": {
      "type": "string",
      "minLength": 1
    },
    "version": {
      "type": [
        "string",
        "null"
      ]
    },
    "capabilities": {
      "type": "array",
      "items": {
        "type": "string"
      }
    },
    "success_rate": { "type": ["number", "null"], "minimum": 0, "maximum": 100 },
    "failure_rate": { "type": ["number", "null"], "minimum": 0, "maximum": 100 },
    "latency": { "type": ["number", "null"], "minimum": 0 },
    "usage": { "type": ["object", "null"] },
    "health": {
      "type": [
        "string",
        "null"
      ]
    },
    "last_seen": {
      "type": [
        "string",
        "null"
      ]
    },
    "timestamp": {
      "type": "string",
      "format": "date-time"
    },
    "source": {
      "type": "string",
      "minLength": 1
    },
    "measurement_type": {
      "enum": [
        "exact",
        "estimated",
        "unavailable"
      ]
    },
    "provenance": {
      "type": [
        "object",
        "string",
        "null"
      ]
    }
  }
}
