[
  {
    "id": "caveman",
    "name": "Caveman",
    "version": "1",
    "capabilities": [
      "prompt-skill-attribution"
    ],
    "health": "UNAVAILABLE",
    "last_seen": null,
    "success_rate": null,
    "failure_rate": null,
    "latency": null,
    "usage": null,
    "measurement_type": "unavailable",
    "source": "packages/maestri-context-gateway/test/core.test.mjs",
    "plugin_id": "caveman"
  }
]
